{
  "schema": "daycube.venue/1",
  "id": "engineering-hall",
  "name": "Engineering Hall (fictional)",
  "entrance": {
    "lat": 43.662,
    "lon": -79.388
  },
  "axis_deg": 12,
  "floor_height_m": 3.2,
  "floors": 3,
  "levels": [
    {
      "index": 0,
      "walls": [
        [
          [
            0,
            0
          ],
          [
            18,
            0
          ]
        ],
        [
          [
            18,
            0
          ],
          [
            18,
            11
          ]
        ]
      ],
      "doors": [
        [
          [
            3,
            0
          ],
          [
            5,
            0
          ]
        ]
      ],
      "stairs": [
        [
          15,
          4.5,
          2.4,
          2
        ]
      ],
      "rooms": [
        {
          "id": "room-0",
          "poly": [
            [
              0,
              0
            ],
            [
              18,
              0
            ],
            [
              18,
              4
            ],
            [
              0,
              4
            ]
          ],
          "kind": "office"
        }
      ],
      "graph": {
        "nodes": [
          [
            1,
            2
          ],
          [
            6,
            2
          ],
          [
            6,
            8
          ]
        ],
        "edges": [
          [
            0,
            1
          ],
          [
            1,
            2
          ]
        ]
      }
    },
    {
      "index": 1,
      "walls": [
        [
          [
            0,
            0
          ],
          [
            18,
            0
          ]
        ],
        [
          [
            18,
            0
          ],
          [
            18,
            11
          ]
        ]
      ],
      "doors": [
        [
          [
            3,
            0
          ],
          [
            5,
            0
          ]
        ]
      ],
      "stairs": [
        [
          15,
          4.5,
          2.4,
          2
        ]
      ],
      "rooms": [
        {
          "id": "room-1",
          "poly": [
            [
              0,
              0
            ],
            [
              18,
              0
            ],
            [
              18,
              4
            ],
            [
              0,
              4
            ]
          ],
          "kind": "office"
        }
      ],
      "graph": {
        "nodes": [
          [
            1,
            2
          ],
          [
            6,
            2
          ],
          [
            6,
            8
          ]
        ],
        "edges": [
          [
            0,
            1
          ],
          [
            1,
            2
          ]
        ]
      }
    },
    {
      "index": 2,
      "walls": [
        [
          [
            0,
            0
          ],
          [
            18,
            0
          ]
        ],
        [
          [
            18,
            0
          ],
          [
            18,
            11
          ]
        ]
      ],
      "doors": [
        [
          [
            3,
            0
          ],
          [
            5,
            0
          ]
        ]
      ],
      "stairs": [
        [
          15,
          4.5,
          2.4,
          2
        ]
      ],
      "rooms": [
        {
          "id": "room-2",
          "poly": [
            [
              0,
              0
            ],
            [
              18,
              0
            ],
            [
              18,
              4
            ],
            [
              0,
              4
            ]
          ],
          "kind": "office"
        }
      ],
      "graph": {
        "nodes": [
          [
            1,
            2
          ],
          [
            6,
            2
          ],
          [
            6,
            8
          ]
        ],
        "edges": [
          [
            0,
            1
          ],
          [
            1,
            2
          ]
        ]
      }
    }
  ],
  "wifi": []
}
